{
  "name": "gemma4-e4b",
  "base": "../../models/gemma-4-E4B-it",
  "variants": {
    "apostate": {
      "path": "../../models/gemma-4-E4B-it-apostate",
      "display_name": "Apostate"
    }
  },
  "settings": {
    "inference_backend": "vllm",
    "tokenizer_dir": "../../models/gemma-4-E4B-it",
    "lm_eval_max_model_len": 8192,
    "lm_eval_max_gen_toks": 2048,
    "harmbench_max_tokens": 4096
  }
}
