{
  "name": "glm47-flash",
  "base": "models/GLM-4.7-Flash",
  "variants": {
    "heretic": {
      "path": "models/GLM-4.7-Flash-heretic",
      "display_name": "Heretic"
    },
    "hauhau": {
      "path": "models/GLM-4.7-Flash-Uncensored-HauhauCS-safetensor",
      "display_name": "HauhauCS"
    },
    "huihui": {
      "path": "models/Huihui-GLM-4.7-Flash-abliterated",
      "display_name": "Huihui"
    },
    "abliterix": {
      "path": "models/GLM-4.7-Flash-abliterated-abliterix",
      "display_name": "Abliterix"
    }
  },
  "settings": {
    "inference_backend": "vllm",
    "tokenizer_dir": "models/GLM-4.7-Flash",
    "lm_eval_tasks": "mmlu,gsm8k,hellaswag,arc_challenge,winogrande,truthfulqa,piqa,lambada_openai",
    "lm_eval_max_model_len": 8192,
    "lm_eval_max_gen_toks": 2048,
    "harmbench_max_tokens": 8096,
    "kl_num_prompts": 100,
    "kl_dataset": "mlabonne/harmless_alpaca"
  }
}
